{
  "schema_version": 1,
  "project": "zuzu-shifting-lands",
  "source_world_manifest": {
    "path": "projects/zuzu-shifting-lands/WORLD-DECKS.json",
    "schema_version": 2
  },
  "status": "draft-not-imported",
  "rules": {
    "encounters_per_location_min": 3,
    "selection": "seeded-weighted-eligible-without-replacement",
    "seed_persisted": true,
    "revisit_policy": "same-recorded-encounter-no-free-reroll",
    "dice": "2d6+skill+modifier-vs-difficulty"
  },
  "locations": [
    {
      "location_id": "cave-mouth",
      "encounter_ids": [
        "feathers-in-the-draft",
        "the-third-shadow",
        "shelter-for-the-storm"
      ]
    },
    {
      "location_id": "stone-hollow",
      "encounter_ids": [
        "the-candle-court",
        "salt-on-the-threshold",
        "the-forgotten-pledge"
      ]
    },
    {
      "location_id": "underground-crossroads",
      "encounter_ids": [
        "three-doors-no-hinges",
        "voices-across-the-rock",
        "the-red-vial"
      ]
    }
  ],
  "encounters": [
    {
      "id": "feathers-in-the-draft",
      "location_id": "cave-mouth",
      "title": "Feathers in the Draft",
      "flavor_text": "At the cave mouth, a crow storm-reader sets paper charms into the wind without letting one blow away. She tells Zuzu the cavern remembers spoken bargains more clearly than faces. A cold current keeps returning from the wrong direction.",
      "polarity": "mixed",
      "weight": 2,
      "unique_per_run": true,
      "first_visit_only": true,
      "art": {
        "status": "design-only",
        "art_ref": null,
        "brief": "Original dark-fantasy Weird West and Edo scene in cave mouth: A crow storm-reader in indigo paper charms holding a tiny brass wind bell; At the cave mouth, a crow storm-reader sets paper charms into the wind without letting one blow away. Atmospheric lantern light, wet rock detail, readable silhouette, no lettering or logos.",
        "cast": [
          {
            "identity": "feathers-in-the-draft-cast",
            "species": "crow",
            "occupation": "storm-reader",
            "visual_description": "A crow storm-reader in indigo paper charms holding a tiny brass wind bell",
            "locked_character_id": null
          }
        ]
      },
      "choices": [
        {
          "id": "answer-her-question-plainly",
          "label": "Answer her question plainly",
          "intent": "Zuzu chooses to answer her question plainly rather than leave this encounter unanswered.",
          "risk_hint": "bearing check against 9; mistakes may cost health or provisions.",
          "roll": {
            "dice_count": 2,
            "die_sides": 6,
            "skill": "bearing",
            "modifier": 0,
            "target": 9
          },
          "success": {
            "text": "The storm-reader accepts Zuzu's name and gives him a chalk sign for a safe entrance.",
            "hp_delta": 0,
            "provisions_delta": 0,
            "add_flags": [
              "feathers-in-the-draft-1-success"
            ],
            "map_effect": "none"
          },
          "failure": {
            "text": "His answer echoes from three passages at once, drawing him into a cold pocket where he loses strength.",
            "hp_delta": -1,
            "provisions_delta": 0,
            "add_flags": [
              "feathers-in-the-draft-1-failure"
            ],
            "map_effect": "none"
          }
        },
        {
          "id": "study-the-returning-draft",
          "label": "Study the returning draft",
          "intent": "Zuzu chooses to study the returning draft rather than leave this encounter unanswered.",
          "risk_hint": "insight check against 10; mistakes may cost health or provisions.",
          "roll": {
            "dice_count": 2,
            "die_sides": 6,
            "skill": "insight",
            "modifier": 0,
            "target": 10
          },
          "success": {
            "text": "Zuzu locates a narrow vent that explains the echo and marks a practical route below.",
            "hp_delta": 0,
            "provisions_delta": 0,
            "add_flags": [
              "feathers-in-the-draft-2-success"
            ],
            "map_effect": "none"
          },
          "failure": {
            "text": "The draft blows out his lantern, and sharp stone punishes his hurried descent.",
            "hp_delta": -2,
            "provisions_delta": 0,
            "add_flags": [
              "feathers-in-the-draft-2-failure"
            ],
            "map_effect": "none"
          }
        }
      ],
      "developer_note": "Pre-authored crow storm-reader; neither supernatural conditions nor disposition arise from species. Preserve the cave's mysteries until earned through play."
    },
    {
      "id": "the-third-shadow",
      "location_id": "cave-mouth",
      "title": "The Third Shadow",
      "flavor_text": "A guide offers to lead Zuzu underground, but three shadows fall behind her from only two lanterns. She insists the third belongs to a traveler who turned back. At the entrance, a line of stones has been rearranged since sunrise.",
      "polarity": "bad",
      "weight": 2,
      "unique_per_run": true,
      "first_visit_only": true,
      "art": {
        "status": "design-only",
        "art_ref": null,
        "brief": "Original dark-fantasy Weird West and Edo scene in cave mouth: A pale bat cave guide with a braided cord and polished stone spectacles; A guide offers to lead Zuzu underground, but three shadows fall behind her from only two lanterns. Atmospheric lantern light, wet rock detail, readable silhouette, no lettering or logos.",
        "cast": [
          {
            "identity": "the-third-shadow-cast",
            "species": "bat",
            "occupation": "cave guide",
            "visual_description": "A pale bat cave guide with a braided cord and polished stone spectacles",
            "locked_character_id": null
          }
        ]
      },
      "choices": [
        {
          "id": "count-the-lantern-positions",
          "label": "Count the lantern positions",
          "intent": "Zuzu chooses to count the lantern positions rather than leave this encounter unanswered.",
          "risk_hint": "awareness check against 10; mistakes may cost health or provisions.",
          "roll": {
            "dice_count": 2,
            "die_sides": 6,
            "skill": "awareness",
            "modifier": 0,
            "target": 10
          },
          "success": {
            "text": "Zuzu finds the hidden third lamp and exposes a staged ambush without drawing his blade.",
            "hp_delta": 0,
            "provisions_delta": 0,
            "add_flags": [
              "the-third-shadow-1-success"
            ],
            "map_effect": "none"
          },
          "failure": {
            "text": "He looks toward the wrong shadow, and a trapper's cord cuts his shoulder as he escapes.",
            "hp_delta": -2,
            "provisions_delta": 0,
            "add_flags": [
              "the-third-shadow-1-failure"
            ],
            "map_effect": "none"
          }
        },
        {
          "id": "demand-a-safer-passage",
          "label": "Demand a safer passage",
          "intent": "Zuzu chooses to demand a safer passage rather than leave this encounter unanswered.",
          "risk_hint": "resolve check against 9; mistakes may cost health or provisions.",
          "roll": {
            "dice_count": 2,
            "die_sides": 6,
            "skill": "resolve",
            "modifier": 0,
            "target": 9
          },
          "success": {
            "text": "The guide abandons the trick and reveals a genuine lower corridor in exchange for mercy.",
            "hp_delta": 0,
            "provisions_delta": 0,
            "add_flags": [
              "the-third-shadow-2-success"
            ],
            "map_effect": "none"
          },
          "failure": {
            "text": "Her accomplices block the gate; Zuzu fights free and loses his spare food.",
            "hp_delta": -1,
            "provisions_delta": -1,
            "add_flags": [
              "the-third-shadow-2-failure"
            ],
            "map_effect": "none"
          }
        }
      ],
      "developer_note": "Pre-authored bat cave guide; neither supernatural conditions nor disposition arise from species. Preserve the cave's mysteries until earned through play."
    },
    {
      "id": "shelter-for-the-storm",
      "location_id": "cave-mouth",
      "title": "Shelter for the Storm",
      "flavor_text": "Rain lashes the ridge where a healer struggles to carry supplies into the cave. She is treating travelers stranded by sudden wind, and her lamp gutters with each gust. Beyond her lies a ledge where the water is already rising.",
      "polarity": "good",
      "weight": 2,
      "unique_per_run": true,
      "first_visit_only": true,
      "art": {
        "status": "design-only",
        "art_ref": null,
        "brief": "Original dark-fantasy Weird West and Edo scene in cave mouth: A cloaked pangolin healer carrying herb satchels and a rain-wet lantern; Rain lashes the ridge where a healer struggles to carry supplies into the cave. Atmospheric lantern light, wet rock detail, readable silhouette, no lettering or logos.",
        "cast": [
          {
            "identity": "shelter-for-the-storm-cast",
            "species": "pangolin",
            "occupation": "itinerant healer",
            "visual_description": "A cloaked pangolin healer carrying herb satchels and a rain-wet lantern",
            "locked_character_id": null
          }
        ]
      },
      "choices": [
        {
          "id": "carry-the-medicine-chest",
          "label": "Carry the medicine chest",
          "intent": "Zuzu chooses to carry the medicine chest rather than leave this encounter unanswered.",